Stage,Capability,Beginner,Intermediate,Advanced,Expert,Next-Gen (2025+)
Plan,Risk Assessment,Security and risk not considered early,Risk addressed late in dev cycle,Threat modeling for some systems,Threat modeling at design phase,AI-driven risk scoring at design level
Plan,Technical Debt Management,Technical debt grows unchecked,Some tech debt addressed,Strategic debt reduction,Low ongoing tech debt,Predictive debt forecasting and optimization
Plan,Prioritization,Bugfix and firefighting dominate,Unplanned work disrupts plans,"New features dominate, some interruptions",Feature-focused engineering,Backlog prioritization augmented by AI risk and value prediction
Plan,AI Code Governance,No review of AI-generated code,Manual reviews of AI output,Linting/policy checks on AI PRs,Risk-scored approvals with human-AI delegation,"Fully integrated AI policy enforcement, explainable outputs, and real-time runtime governance"
Plan,Prompt Engineering,No AI prompt standardization,Prompts used ad hoc by developers,Prompt libraries and quality controls introduced,Prompt patterns reusable and shared,"Versioned prompt libraries, telemetry, AI bias detectors"
Plan,Internal Documentation Quality,No documentation practice,Ad hoc docs with unclear ownership,Maintained docs with ownership and reviews,"Searchable, versioned, context-linked internal docs","AI-generated + usage-monitored docs, context-aware updates, metric-linked doc impact"
Develop,Trunk-Based Development,Long-lived feature branches,Branching with partial merges,Trunk-based for stable components,Trunk-based for all production services,"Trunk-based with AI-enabled merge assistants, batch size validation"
Develop,Code Validation,No code validation,Manual validation,SAST for some code,SAST integrated into development,AI-assisted code review and pattern recognition for early bug/risk detection
Develop,AI Output Validation,Manual validation only,Automated test suites partially cover AI-generated code,AI outputs validated via mutation tests and static analysis,Cross-validation between AI-generated and peer-reviewed logic,"Trust scores for AI code, hallucination detection"
Develop,Change Size Control,No limits on PR size,Advisory max PR size with peer reminders,Enforced PR limits and chunking,"AI suggests PR refactoring into smaller, testable chunks","Risk-weighted PR gates, impact-aware batch shaping, automated context splitting"
Build,Secrets Management,Hardcoded credentials,Basic vault usage,Centralized secrets storage,Integrated secrets rotation,AI-based anomaly detection and automatic revocation
Build,Software Composition Analysis,Not performed,Manual open-source audits,Integrated SCA tools in CI/CD,Automated SCA + license validation,AI-prioritized SCA based on exploit likelihood and business risk
Build,Build Validation,No validation,Partial validation,Build/signature validation mostly automated,Complete validation for all builds,Self-healing pipelines using anomaly detection
Build,Quality Assurance,No core functionality tested,Infrequent testing of core functionality,Frequent core testing,Continuous and automated testing of all apps,AI-driven test coverage optimization and confidence scoring
Test,Test Automation,Manual testing only,Some test automation,Mostly automated testing,Full test automation,LLM-generated test suites and risk-based test case selection
Test,Code Scanning,No scanning,Partial code scanning,DAST for some code,DAST across all code,AI-enhanced static and dynamic scanning with exploit prediction
Test,TDD/BDD for IaC,No tests or linting,Basic linting for syntax/style,Unit tests using terratest/molecule,BDD-style tests using Gherkin frameworks,AI-generated test cases with drift detection and env simulation
Release,Deployment Validation,No security validation,Limited security checks,Automated validation steps,Policy-driven and fully automated,ML-based release gate risk scoring and auto-abort
Release,Deployment Strategy,Waterfall model,Monthly cadence,"Weekly modern strategies (canary, blue-green)",Multiple daily releases,Continuous delivery driven by predictive quality scoring
Release,Deployment Remediation,Manual and slow rollback,Basic rollback ability,Forward fix and rollback,Bias for forward fix with fast execution,AI-suggested rollback/fix strategies and automatic remediation execution
Release,Trunk-Based & Batch Integration,Feature branches merged weekly; long-lived PRs,Merges occur within days; CI on merge only,Daily merges to trunk; CI tests run on commit,"All commits trunk-ready, tested, and deployable; small batch size enforced","AI-enforced batch shaping, commit-level risk scoring, auto PR refactoring"
Release,Post-Deployment Testing,No checks after prod deployment,Manual post-deploy validation,Automated smoke tests triggered post-release,Sanity/smoke tests integrated into CD pipeline with rollback logic,AI-monitored release validation with real-user journey tracing and anomaly scoring
Deploy,Deployment Automation,Manual deployments,Partially automated,Mostly automated,Fully automated CI/CD,AI-prioritized pipelines based on risk and business impact
Deploy,AI-Optimized Deployment,Manual deployments without rollout logic,Basic blue-green/canary rollout with human oversight,Automated rollouts with rollback criteria,Release gates use observability-driven signals,"AI segment-aware releases, dynamic rollout, batch size enforcement"
Operate,Platform Management,Manual configurations,Partial automation,IaC and automation dominant,Full IaC and automation,AI-managed infrastructure drift detection and remediation
Operate,Capacity Planning,Annual CapEx planning,Basic growth assumptions,Forecasting used,Predictive trend-based planning,AI-optimized scaling based on real-time usage
Operate,Scaling,Manual,Mixed scaling,Partial auto-scaling,Conditional auto-scaling,Predictive auto-scaling before traffic spikes
Operate,Reliability,Single AZ/Region,Multi-AZ,Multi-region HA,"Very high availability, multi-cloud",Failure forecasting via AI models
Operate,Resiliency Testing,No testing,Basic chaos tests,Frequent chaos/red teaming,Continuous chaos testing,"Fuzzy logic testing, chaos-as-code integrated into CI/CD"
Operate,Patching,Ad hoc patching,Regular patching,SLA-aware patching,Patch SLA defined,Predictive patching and vulnerability anticipation
Operate,Disaster Recovery,No DR plan,Basic untested DR,Semi-regular DR tests,Regular and validated DR plans,AI-simulated DR scenarios with auto-fix playbooks and validation dashboards
Operate,Infrastructure Hardening,Not done,Manual reviews,Templates for some infra,Infra-as-code policies enforced,AI-audited hardened templates and compliance drift detection
Operate,Secure Container Practices,No isolation,Minimal scanning,Regular base image scanning,CIS compliance + runtime protection,AI-assisted image risk scoring and auto-rebuilds
Operate,Explainable AI in Operations,AI decisions are black-box,Basic logging of AI ops actions,AI suggestions logged and traced with metadata,Explainability tools integrated into ops dashboards,"Human-in-the-loop control, transparency, learning integration"
Operate,Developer Independence,All changes must go through platform team,Manual override allowed for edge cases,Self-service flows with platform guidance,Autonomous dev environments with full platform observability,"Adaptive golden paths, AI feedback loops, contextual break-glass mechanisms"
Observe,SLOs,No SLOs,Basic SLOs,SLOs tied to operations,SLOs drive engineering decisions,AI-predicted SLO burn and drift
Observe,Vulnerability Scanning,No scanning,Partial scanning,Significant coverage,Continuous and automated,Predictive scanning + exploit simulation
Observe,Security Monitoring,No metrics,Basic alerting,Full-stack visibility,Full metrics and context,Autonomous anomaly detection and incident creation
Observe,User Experience,No visibility,Partial view,Detailed UX monitoring,Full visibility into journeys,"LLM-interpreted UX anomalies, sentiment-aware"
Observe,UX Observability,No instrumentation for user journey,"Basic telemetry (e.g., page loads, errors)","Heatmaps, funnel tracking, journey maps","Full user session observability, alerts on friction points","AI-based UX anomaly detection, real-time friction scoring, executive UX health reports"
Observe,Feedback Loop Quality,No AI feedback mechanisms,Some telemetry-based alerts,AI-generated RCA summaries in use,RCA auto-classification and observability insights,"Real-time feedback freshness tracking, trust scores, explainability"
Observe,Incident Management,"Manual, slow response","Response improved, still manual",Timely response and RCA,"Low MTTD/MTTR, SLA-backed","LLM triage, auto-classification, and response actions"
Observe,Root Cause Analysis,None,Manual and reactive,Structured RCA conducted,RCA with tracked outcomes,AI-generated RCAs and system-learned remediations
Observe,Post-mortems,No formal reviews,Inconsistent learnings,"Blameless, tracked action items","Integrated, action-oriented postmortems","NLP-generated RCAs, auto-created tickets, and learning ingestion into LLMs"
Observe,Delivery Performance Modeling,No distinction between throughput and stability,Tracks lead time and deploy frequency,Adds change failure rate and MTTR,Tracks all four DORA metrics across services,"Includes rework rate, predictive delivery modeling, AI-assisted remediation cycles"
Secure,Compliance Automation,Manual evidence collection,Central repository,Partial automation with policy enforcement,Fully automated controls mapping,AI-mapped controls to regulatory frameworks with continuous evidence gathering
Secure,SBOM,No visibility,Manual tracking,Partial generation during builds,SBOM integrated with releases,Real-time SBOM with AI-inferred dependency graph risk scoring
Secure,Runtime Protection,Not implemented,Logging-only,Basic runtime alerting,Behavioral monitoring in place,AI-driven workload protection and anomaly enforcement
Secure,Security Awareness Training,Not conducted,Ad hoc training sessions,Periodic role-based training,Continuous mandatory training,Personalized AI-driven training paths with adaptive testing
Secure,Security Champion Program,Not established,Single security lead per team,Champions trained in some teams,Champions embedded across teams,"AI-assisted champion development, cross-team coordination"
Culture,Communication,Siloed by functional team,Limited to Dev and Ops teams Security remains siloed,Security regularly shares with Dev/Ops,"Transparent, high-trust, cross-functional collaboration",Culture reinforced by AI-driven team health monitoring and automated onboarding insights
Culture,Onboarding,No standardized onboarding process,Onboarding process exists but ramp-up is slow,Engineers considered productive after onboarding,Comprehensive onboarding,"Onboarding workflows adapt based on role, past success, and AI feedback"
Culture,Accountability,"Fear, lack of trust, blame, and fingerpointing","Some transparency, some experimentation",Blameless culture adopted,High psychological safety,AI-assisted behavioral metrics reinforce accountability without blame
Culture,Team Health,Team members not able to discuss burnout and not empowered to take mitigation measures,Burnout discussed but no structural changes,Burnout managed via manager training,Burnout rare and promptly addressed,"AI-enabled early burnout detection, automated health trend reporting"
Culture,User-Centric Development,No structured user feedback,Feedback collected post-launch,User interviews guide backlog,"Continuous UX research, journey analytics","AI-curated UX signals, real-time sentiment mining, UX risk flags in planning systems"
Culture,Developer Value Preservation,No consideration of perceived work value,Burnout discussed but no action taken,"Burnout tracked, engagement surveys conducted",Blameless culture; regular health checks,AI-driven value-perception metrics; opt-out for personal meaning
Operate,Developer Independence,All changes must go through platform team,Manual override allowed for edge cases,Self-service flows with platform guidance,Autonomous dev environments with full platform observability,"Adaptive golden paths, AI feedback loops, contextual break-glass mechanisms"
Release,Trunk-Based Development & Small Batch Integration,Feature branches merged weekly; long-lived PRs,Merges occur within days; CI on merge only,Daily merges to trunk; CI tests run on commit,"All commits trunk-ready, tested, and deployable; small batch size enforced","AI-enforced batch shaping, commit-level risk scoring, auto PR refactoring"
Release,Post-Deployment Testing,No post-deployment checks.,"Manual smoke test (e.g., someone confirms basic functionality via CLI or UI).","Automated smoke test jobs executed post-release (e.g., status code, DB access).","Sanity/smoke tests built into CD pipeline with rollback criteria, alerts, and gates.","AI-monitored release validation with live traffic simulation, UX session replays, and automatic impact scoring."
Observe,Data Model & Access,Data silos,Partial observability,Shared data platform,"Standardized, tagged data",Auto-tagged metadata model with self-healing context stitching
Plan,Trunk-Based Development,Long-lived feature branches,Branching with partial merges,Trunk-based for stable components,Trunk-based for all production services,"Trunk-based with AI-enabled merge assistants, batch size validation"
Plan,Internal Documentation Quality,No documentation practice,Ad hoc docs with unclear ownership,Maintained docs with ownership and reviews,"Searchable, versioned, context-linked internal docs","AI-generated + usage-monitored docs, context-aware updates, metric-linked doc impact"
Plan,"AI Lifecycle Governance (Models, Prompts, Outcomes)","Models untracked, prompts ad hoc, outcomes unchecked","Known model sources, basic prompt reuse, manual output validation","Version-controlled models, structured prompts, tested outcomes","Bias detection, prompt engineering playbooks, validated outcome quality","Self-tuning prompt–model pairs, AI impact dashboards, auto-correction of hallucinations"
Observe,Error Budgets,Not used,"Defined, not tracked",Reviewed in retrospectives,Enforce release decisions,Live burn modeling and proactive throttling
